{
  "name": "excalidraw-mcp-server",
  "description": "An MCP server for creating and editing Excalidraw whiteboard diagrams — add shapes and elements, render views, and save or load drawing checkpoints.",
  "version": "0.1.0",
  "author": {
    "name": "Harvard University Information Technology (HUIT)"
  },
  "keywords": [
    "mcp",
    "excalidraw",
    "diagrams",
    "whiteboard",
    "drawing"
  ],
  "homepage": "https://docs.excalidraw.com/docs"
}
