{
  "name": "manage-marketplace",
  "displayName": "Manage Marketplace",
  "description": "Create and run your team's own Claude Code + Codex plugin marketplace on GitHub.",
  "version": "1.0.1",
  "author": {
    "name": "Harvard University Information Technology (HUIT)"
  },
  "keywords": [
    "marketplace",
    "plugins",
    "mcp",
    "admin"
  ],
  "homepage": "https://github.com/harvard-ea/plugin-marketplace-manager"
}
