{
  "name": "example-github",
  "description": "Example MCP server requiring a personal access token. The marketplace never distributes credentials — installers replace the placeholder with their own.",
  "version": "0.1.0",
  "author": {
    "name": "Harvard University Information Technology (HUIT)"
  },
  "keywords": [
    "mcp",
    "example",
    "developer-tools"
  ],
  "homepage": "https://github.com/harvard-huit/huit-plugin-marketplace"
}
